{
  "dataset_id": "D-14",
  "title": "Hướng dẫn an toàn khi khẩn cấp",
  "owner_team": "Hoàng",
  "world_version": "2026-10-12",
  "origin": "public",
  "origin_detail": {
    "source_url": "ĐIỀN: địa chỉ văn bản gốc",
    "retrieved_on": "2026-10-13",
    "content_sha256": "ĐIỀN: mã băm của bản chụp",
    "confirmed_by_operator": false
  },
  "files": [
    {
      "path": "data/D-14/huong-dan-khan-cap.md",
      "format": "md",
      "records": 6
    }
  ],
  "load_command": "python -m tools.data load D-14",
  "reviewed_by": "ĐIỀN: tên người rà",
  "reviewed_on": "2026-10-15",
  "sample_checked": 6
}
